,Case No.,Claimant(s),Respondent(s),Status,Link
633,ARB/98/1,"Houston Industries Energy, Inc. and others",Argentine Republic ,Concluded,https://icsid.worldbank.org/cases/case-database/case-detail?CaseNo=ARB/98/1
634,ARB(AF)/98/3,"The Loewen Group, Inc. and Raymond L. Loewen ",United States of America ,Concluded,https://icsid.worldbank.org/cases/case-database/case-detail?CaseNo=ARB(AF)/98/3
635,ARB(AF)/98/2,"Waste Management, Inc.",United Mexican States ,Concluded,https://icsid.worldbank.org/cases/case-database/case-detail?CaseNo=ARB(AF)/98/2
636,ARB(AF)/98/1,Joseph C. Lemire ,Ukraine ,Concluded,https://icsid.worldbank.org/cases/case-database/case-detail?CaseNo=ARB(AF)/98/1
637,ARB/97/8,Compagnie Française pour le Développement des Fibres Textiles ,Côte d'Ivoire,Concluded,https://icsid.worldbank.org/cases/case-database/case-detail?CaseNo=ARB/97/8
638,ARB/97/7,Emilio Agustín Maffezini ,Kingdom of Spain ,Concluded,https://icsid.worldbank.org/cases/case-database/case-detail?CaseNo=ARB/97/7
639,ARB/97/6,"Lanco International, Inc.",Argentine Republic ,Concluded,https://icsid.worldbank.org/cases/case-database/case-detail?CaseNo=ARB/97/6
640,ARB/97/5,WRB Enterprises and Grenada Private Power Limited ,Grenada,Concluded,https://icsid.worldbank.org/cases/case-database/case-detail?CaseNo=ARB/97/5
641,ARB/97/4,"Československa obchodní banka, a.s.",Slovak Republic ,Concluded,https://icsid.worldbank.org/cases/case-database/case-detail?CaseNo=ARB/97/4
642,ARB/97/3,Compañía de Aguas del Aconquija S.A. and Vivendi Universal S.A.,Argentine Republic ,Concluded,https://icsid.worldbank.org/cases/case-database/case-detail?CaseNo=ARB/97/3
643,ARB/97/2,Société Kufpec (Congo) Limited ,Republic of Congo ,Concluded,https://icsid.worldbank.org/cases/case-database/case-detail?CaseNo=ARB/97/2
644,ARB/97/1,Société d'Investigation de Recherche et d'Exploitation Minière,Burkina Faso ,Concluded,https://icsid.worldbank.org/cases/case-database/case-detail?CaseNo=ARB/97/1
645,ARB(AF)/97/2,Robert Azinian and others ,United Mexican States ,Concluded,https://icsid.worldbank.org/cases/case-database/case-detail?CaseNo=ARB(AF)/97/2
646,ARB(AF)/97/1,Metalclad Corporation ,United Mexican States ,Concluded,https://icsid.worldbank.org/cases/case-database/case-detail?CaseNo=ARB(AF)/97/1
647,ARB/96/3,Fedax N.V.,Republic of Venezuela ,Concluded,https://icsid.worldbank.org/cases/case-database/case-detail?CaseNo=ARB/96/3
648,ARB/96/2,Misima Mines Pty. Ltd. ,Independent State of Papua New Guinea ,Concluded,https://icsid.worldbank.org/cases/case-database/case-detail?CaseNo=ARB/96/2
649,ARB/96/1,Compañia del Desarrollo de Santa Elena S.A. ,Republic of Costa Rica ,Concluded,https://icsid.worldbank.org/cases/case-database/case-detail?CaseNo=ARB/96/1
650,ARB/95/3,Antoine Goetz and others ,Republic of Burundi ,Concluded,https://icsid.worldbank.org/cases/case-database/case-detail?CaseNo=ARB/95/3
651,ARB/95/2,"Cable Television of Nevis, Ltd. and Cable Television of Nevis Holdings, Ltd.",Federation of St. Kitts and Nevis ,Concluded,https://icsid.worldbank.org/cases/case-database/case-detail?CaseNo=ARB/95/2
652,ARB/95/1,Leaf Tobacco A. Michaelides S.A. and Greek-Albanian Leaf Tobacco & Co. S.A.,Republic of Albania ,Concluded,https://icsid.worldbank.org/cases/case-database/case-detail?CaseNo=ARB/95/1
653,ARB/94/2,Tradex Hellas S.A.,Republic of Albania ,Concluded,https://icsid.worldbank.org/cases/case-database/case-detail?CaseNo=ARB/94/2
654,CONC/94/1,SEDITEX Engineering Beratungsgesellschaft für dieTextilindustrie m.b.H.,Madagascar,Concluded,https://icsid.worldbank.org/cases/case-database/case-detail?CaseNo=CONC/94/1
655,ARB/94/1,Philippe Gruslin ,Malaysia,Concluded,https://icsid.worldbank.org/cases/case-database/case-detail?CaseNo=ARB/94/1
656,ARB/93/1,"American Manufacturing & Trading, Inc.",Democratic Republic of the Congo ,Concluded,https://icsid.worldbank.org/cases/case-database/case-detail?CaseNo=ARB/93/1
657,ARB/92/2,Scimitar Exploration Limited ,"Bangladesh and Bangladesh Oil, Gas and Mineral Corporation",Concluded,https://icsid.worldbank.org/cases/case-database/case-detail?CaseNo=ARB/92/2
658,ARB/92/1,Vacuum Salt Products Ltd.,Republic of Ghana ,Concluded,https://icsid.worldbank.org/cases/case-database/case-detail?CaseNo=ARB/92/1
659,ARB/89/1,Manufacturers Hanover Trust Company ,Arab Republic of Egypt and General Authority for Investment and Free Zones,Concluded,https://icsid.worldbank.org/cases/case-database/case-detail?CaseNo=ARB/89/1
660,ARB/87/4,"Occidental of Pakistan, Inc.",Islamic Republic of Pakistan ,Concluded,https://icsid.worldbank.org/cases/case-database/case-detail?CaseNo=ARB/87/4
661,ARB/87/3,Asian Agricultural Products Limited ,Democratic Socialist Republic of Sri Lanka ,Concluded,https://icsid.worldbank.org/cases/case-database/case-detail?CaseNo=ARB/87/3
662,ARB/87/2,Mobil Oil Corporation and others ,New Zealand ,Concluded,https://icsid.worldbank.org/cases/case-database/case-detail?CaseNo=ARB/87/2
663,ARB/87/1,Société d'Études de Travaux et de Gestion SETIMEG S.A.,Gabonese Republic,Concluded,https://icsid.worldbank.org/cases/case-database/case-detail?CaseNo=ARB/87/1
664,ARB/86/1,Ghaith R. Pharaon ,Republic of Tunisia ,Concluded,https://icsid.worldbank.org/cases/case-database/case-detail?CaseNo=ARB/86/1
665,ARB/84/4,Maritime International Nominees Establishment ,Republic of Guinea ,Concluded,https://icsid.worldbank.org/cases/case-database/case-detail?CaseNo=ARB/84/4
666,ARB/84/3,Southern Pacific Properties (Middle East) Limited ,Arab Republic of Egypt ,Concluded,https://icsid.worldbank.org/cases/case-database/case-detail?CaseNo=ARB/84/3
667,ARB/84/2,Colt Industries Operating Corporation ,Republic of Korea,Concluded,https://icsid.worldbank.org/cases/case-database/case-detail?CaseNo=ARB/84/2
668,ARB/84/1,Atlantic Triton Company Limited ,People's Revolutionary Republic of Guinea,Concluded,https://icsid.worldbank.org/cases/case-database/case-detail?CaseNo=ARB/84/1
669,CONC/83/1,Tesoro Petroleum Corporation,Trinidad and Tobago ,Concluded,https://icsid.worldbank.org/cases/case-database/case-detail?CaseNo=CONC/83/1
670,ARB/83/2,Liberian Eastern Timber Corporation ,Republic of Liberia ,Concluded,https://icsid.worldbank.org/cases/case-database/case-detail?CaseNo=ARB/83/2
671,ARB/83/1,Swiss Aluminium Limited and Icelandic Aluminium Company Limited ,Iceland ,Concluded,https://icsid.worldbank.org/cases/case-database/case-detail?CaseNo=ARB/83/1
672,CONC/82/1,SEDITEX Engineering Beratungsgesellschaft für die Textilindustrie m.b.H.,Democratic Republic of Madagascar ,Concluded,https://icsid.worldbank.org/cases/case-database/case-detail?CaseNo=CONC/82/1
673,ARB/82/1,Société Ouest Africaine des Bétons Industriels ,Republic of Senegal ,Concluded,https://icsid.worldbank.org/cases/case-database/case-detail?CaseNo=ARB/82/1
674,ARB/81/2,Klöckner Industrie-Anlagen GmbH and others ,United Republic of Cameroon and Société Camerounaise des Engrais,Concluded,https://icsid.worldbank.org/cases/case-database/case-detail?CaseNo=ARB/81/2
675,ARB/81/1,Amco Asia Corporation and others ,Republic of Indonesia ,Concluded,https://icsid.worldbank.org/cases/case-database/case-detail?CaseNo=ARB/81/1
676,ARB/78/1,Guadalupe Gas Products Corporation,Nigeria ,Concluded,https://icsid.worldbank.org/cases/case-database/case-detail?CaseNo=ARB/78/1
677,ARB/77/2,S.A.R.L. Benvenuti & Bonfant ,People's Republic of the Congo,Concluded,https://icsid.worldbank.org/cases/case-database/case-detail?CaseNo=ARB/77/2
678,ARB/77/1,AGIP S.p.A.,People's Republic of the Congo,Concluded,https://icsid.worldbank.org/cases/case-database/case-detail?CaseNo=ARB/77/1
679,ARB/76/1,Gabon ,Société Serete S.A.,Concluded,https://icsid.worldbank.org/cases/case-database/case-detail?CaseNo=ARB/76/1
680,ARB/74/4,Reynolds Jamaica Mines Limited and  Reynolds Metals Company,Jamaica,Concluded,https://icsid.worldbank.org/cases/case-database/case-detail?CaseNo=ARB/74/4
681,ARB/74/3,Kaiser Bauxite Company ,Jamaica,Concluded,https://icsid.worldbank.org/cases/case-database/case-detail?CaseNo=ARB/74/3
682,ARB/74/2,"Alcoa Minerals of Jamaica, Inc. ",Jamaica,Concluded,https://icsid.worldbank.org/cases/case-database/case-detail?CaseNo=ARB/74/2
683,ARB/74/1,Adriano Gardella S.p.A. ,Côte d'Ivoire,Concluded,https://icsid.worldbank.org/cases/case-database/case-detail?CaseNo=ARB/74/1
684,ARB/72/1,Holiday Inns S.A. and others,Morocco,Concluded,https://icsid.worldbank.org/cases/case-database/case-detail?CaseNo=ARB/72/1
685,ARB/07/23,Railroad Development Corporation ,Republic of Guatemala ,Concluded,https://icsid.worldbank.org/cases/case-database/case-detail?CaseNo=ARB/07/23
686,CONC/07/1,Shareholders of SESAM ,Central African Republic ,Concluded,https://icsid.worldbank.org/cases/case-database/case-detail?CaseNo=CONC/07/1
687,ARB/07/22,AES Summit Generation Limited and AES-Tisza Erömü Kft.,Hungary ,Concluded,https://icsid.worldbank.org/cases/case-database/case-detail?CaseNo=ARB/07/22
688,ARB/07/21,Pantechniki S.A. Contractors & Engineers ,Republic of Albania ,Concluded,https://icsid.worldbank.org/cases/case-database/case-detail?CaseNo=ARB/07/21
689,ARB/07/20,Saba Fakes ,Republic of Turkey ,Concluded,https://icsid.worldbank.org/cases/case-database/case-detail?CaseNo=ARB/07/20
690,ARB/07/19,Electrabel S.A. ,Hungary ,Concluded,https://icsid.worldbank.org/cases/case-database/case-detail?CaseNo=ARB/07/19
691,ARB/07/18,Shell Nigeria Ultra Deep Limited ,Federal Republic of Nigeria ,Concluded,https://icsid.worldbank.org/cases/case-database/case-detail?CaseNo=ARB/07/18
692,ARB/07/17,Impregilo S.p.A. ,Argentine Republic ,Concluded,https://icsid.worldbank.org/cases/case-database/case-detail?CaseNo=ARB/07/17
693,ARB/07/16,Alpha Projektholding GmbH ,Ukraine,Concluded,https://icsid.worldbank.org/cases/case-database/case-detail?CaseNo=ARB/07/16
694,ARB/07/15,Ron Fuchs ,Georgia,Concluded,https://icsid.worldbank.org/cases/case-database/case-detail?CaseNo=ARB/07/15
695,ARB/07/14,Liman Caspian Oil BV and NCL Dutch Investment BV ,Republic of Kazakhstan ,Concluded,https://icsid.worldbank.org/cases/case-database/case-detail?CaseNo=ARB/07/14
696,ARB/07/13,S&T Oil Equipment & Machinery Ltd. ,Romania,Concluded,https://icsid.worldbank.org/cases/case-database/case-detail?CaseNo=ARB/07/13
697,ARB/07/12,Toto Costruzioni Generali S.p.A. ,Lebanese Republic,Concluded,https://icsid.worldbank.org/cases/case-database/case-detail?CaseNo=ARB/07/12
698,ARB/07/11,ALAS International Baustoffproduktions AG,Bosnia and Herzegovina ,Concluded,https://icsid.worldbank.org/cases/case-database/case-detail?CaseNo=ARB/07/11
699,ARB/07/10,M. Meerapfel Söhne AG,Central African Republic ,Concluded,https://icsid.worldbank.org/cases/case-database/case-detail?CaseNo=ARB/07/10
700,ARB/07/9,"Bureau Veritas, Inspection, Valuation, Assessment and Control, BIVAC B.V.",Republic of Paraguay ,Concluded,https://icsid.worldbank.org/cases/case-database/case-detail?CaseNo=ARB/07/9
701,ARB/07/8,Giovanni Alemanni and others,Argentine Republic,Concluded,https://icsid.worldbank.org/cases/case-database/case-detail?CaseNo=ARB/07/8
702,ARB(AF)/07/3,Alasdair Ross Anderson and others ,Republic of Costa Rica ,Concluded,https://icsid.worldbank.org/cases/case-database/case-detail?CaseNo=ARB(AF)/07/3
703,ARB(AF)/07/2,Europe Cement Investment and Trade S.A.,Republic of Turkey ,Concluded,https://icsid.worldbank.org/cases/case-database/case-detail?CaseNo=ARB(AF)/07/2
704,ARB/07/7,Global Gold Mining LLC ,Republic of Armenia ,Concluded,https://icsid.worldbank.org/cases/case-database/case-detail?CaseNo=ARB/07/7
705,ARB/07/6,Tza Yap Shum ,Republic of Peru ,Concluded,https://icsid.worldbank.org/cases/case-database/case-detail?CaseNo=ARB/07/6
706,ARB/07/5,Abaclat and others ,Argentine Republic ,Concluded,https://icsid.worldbank.org/cases/case-database/case-detail?CaseNo=ARB/07/5
707,ARB/07/4,Eni Dación B.V. ,Bolivarian Republic of Venezuela,Concluded,https://icsid.worldbank.org/cases/case-database/case-detail?CaseNo=ARB/07/4
708,ARB/07/3,Government of the Province of East Kalimantan,PT Kaltim Prima Coal and others ,Concluded,https://icsid.worldbank.org/cases/case-database/case-detail?CaseNo=ARB/07/3
709,ARB/07/2,RSM Production Corporation ,Central African Republic ,Concluded,https://icsid.worldbank.org/cases/case-database/case-detail?CaseNo=ARB/07/2
710,ARB/07/1,Fondel Metal Participations B.V. ,Republic of Azerbaijan ,Concluded,https://icsid.worldbank.org/cases/case-database/case-detail?CaseNo=ARB/07/1
711,ARB(AF)/07/1,"Piero Foresti, Laura de Carli and others",Republic of South Africa ,Concluded,https://icsid.worldbank.org/cases/case-database/case-detail?CaseNo=ARB(AF)/07/1
712,ARB/06/21,City Oriente Limited,Republic of Ecuador and Empresa Estatal Petróleos del Ecuador (Petroecuador),Concluded,https://icsid.worldbank.org/cases/case-database/case-detail?CaseNo=ARB/06/21
713,ARB/06/19,"Nations Energy, Inc. and others ",Republic of Panama ,Concluded,https://icsid.worldbank.org/cases/case-database/case-detail?CaseNo=ARB/06/19
714,ARB/06/18,Joseph C. Lemire ,Ukraine,Concluded,https://icsid.worldbank.org/cases/case-database/case-detail?CaseNo=ARB/06/18
715,ARB(AF)/06/2,"Cementownia ""Nowa Huta"" S.A.",Republic of Turkey ,Concluded,https://icsid.worldbank.org/cases/case-database/case-detail?CaseNo=ARB(AF)/06/2
716,ARB/06/17,"Técnicas Reunidas, S.A. and Eurocontrol, S.A. ",Republic of Ecuador ,Concluded,https://icsid.worldbank.org/cases/case-database/case-detail?CaseNo=ARB/06/17
717,ARB/06/16,Barmek Holding A.S.,Republic of Azerbaijan ,Concluded,https://icsid.worldbank.org/cases/case-database/case-detail?CaseNo=ARB/06/16
718,ARB/06/15,"Azpetrol International Holdings B.V., Azpetrol Group B.V. and Azpetrol Oil Services Group B.V.",Republic of Azerbaijan ,Concluded,https://icsid.worldbank.org/cases/case-database/case-detail?CaseNo=ARB/06/15
719,ARB/06/13,"Aguaytia Energy, LLC ",Republic of Peru ,Concluded,https://icsid.worldbank.org/cases/case-database/case-detail?CaseNo=ARB/06/13
720,ARB/06/12,Scancem International ANS ,Republic of Congo ,Concluded,https://icsid.worldbank.org/cases/case-database/case-detail?CaseNo=ARB/06/12
721,ARB/06/11,Occidental Petroleum Corporation and Occidental Exploration and Production Company ,Republic of Ecuador ,Concluded,https://icsid.worldbank.org/cases/case-database/case-detail?CaseNo=ARB/06/11
722,ARB/06/10,"Chevron Bangladesh Block Twelve, Ltd. and Chevron Bangladesh Blocks Thirteen and Fourteen, Ltd.",People's Republic of Bangladesh,Concluded,https://icsid.worldbank.org/cases/case-database/case-detail?CaseNo=ARB/06/10
723,ARB/06/9,Branimir Mensik ,Slovak Republic ,Concluded,https://icsid.worldbank.org/cases/case-database/case-detail?CaseNo=ARB/06/9
724,ARB/06/8,Libananco Holdings Co. Limited,Republic of Turkey ,Concluded,https://icsid.worldbank.org/cases/case-database/case-detail?CaseNo=ARB/06/8
725,ARB(AF)/06/1,Sistem Muhendislik Insaat Sanayi ve Ticaret A.S. ,Kyrgyz Republic ,Concluded,https://icsid.worldbank.org/cases/case-database/case-detail?CaseNo=ARB(AF)/06/1
726,ARB/06/7,Togo Electricité and GDF-Suez Energie Services,Republic of Togo ,Concluded,https://icsid.worldbank.org/cases/case-database/case-detail?CaseNo=ARB/06/7
727,ARB/06/5,Phoenix Action Ltd ,Czech Republic ,Concluded,https://icsid.worldbank.org/cases/case-database/case-detail?CaseNo=ARB/06/5
728,ARB/06/4,Vestey Group Ltd ,Bolivarian Republic of Venezuela ,Concluded,https://icsid.worldbank.org/cases/case-database/case-detail?CaseNo=ARB/06/4
729,ARB/06/3,The Rompetrol Group N.V. ,Romania,Concluded,https://icsid.worldbank.org/cases/case-database/case-detail?CaseNo=ARB/06/3
730,ARB/06/2,Quiborax S.A. and Non-Metallic Minerals S.A.,Plurinational State of Bolivia ,Concluded,https://icsid.worldbank.org/cases/case-database/case-detail?CaseNo=ARB/06/2
731,ARB/06/1,Spyridon Roussalis ,Romania,Concluded,https://icsid.worldbank.org/cases/case-database/case-detail?CaseNo=ARB/06/1
732,ARB/05/24,Hrvatska Elektroprivreda d.d. ,Republic of Slovenia ,Concluded,https://icsid.worldbank.org/cases/case-database/case-detail?CaseNo=ARB/05/24
733,ARB/05/23,Ares International S.r.l. and MetalGeo S.r.l.,Georgia,Concluded,https://icsid.worldbank.org/cases/case-database/case-detail?CaseNo=ARB/05/23
734,ARB/05/22,Biwater Gauff (Tanzania) Limited,United Republic of Tanzania,Concluded,https://icsid.worldbank.org/cases/case-database/case-detail?CaseNo=ARB/05/22
735,ARB/05/21,"African Holding Company of America, Inc. and Société Africaine de Construction au Congo S.A.R.L. ",Democratic Republic of the Congo ,Concluded,https://icsid.worldbank.org/cases/case-database/case-detail?CaseNo=ARB/05/21
736,ARB/05/20,"Ioan Micula, Viorel Micula and others ",Romania,Concluded,https://icsid.worldbank.org/cases/case-database/case-detail?CaseNo=ARB/05/20
737,ARB/05/19,Helnan International Hotels A/S ,Arab Republic of Egypt ,Concluded,https://icsid.worldbank.org/cases/case-database/case-detail?CaseNo=ARB/05/19
738,ARB/05/18,Ioannis Kardassopoulos ,Georgia,Concluded,https://icsid.worldbank.org/cases/case-database/case-detail?CaseNo=ARB/05/18
739,ARB/05/17,Desert Line Projects LLC ,Republic of Yemen,Concluded,https://icsid.worldbank.org/cases/case-database/case-detail?CaseNo=ARB/05/17
740,ARB/05/16,Rumeli Telekom A.S. and Telsim Mobil Telekomunikasyon Hizmetleri A.S. ,Republic of Kazakhstan ,Concluded,https://icsid.worldbank.org/cases/case-database/case-detail?CaseNo=ARB/05/16
741,ARB(AF)/05/2,"Cargill, Incorporated ",United Mexican States ,Concluded,https://icsid.worldbank.org/cases/case-database/case-detail?CaseNo=ARB(AF)/05/2
742,ARB/05/15,Waguih Elie George Siag and Clorinda Vecchi ,Arab Republic of Egypt ,Concluded,https://icsid.worldbank.org/cases/case-database/case-detail?CaseNo=ARB/05/15
743,ARB/05/14,RSM Production Corporation ,Grenada ,Concluded,https://icsid.worldbank.org/cases/case-database/case-detail?CaseNo=ARB/05/14
744,ARB/05/13,EDF (Services) Limited ,Romania,Concluded,https://icsid.worldbank.org/cases/case-database/case-detail?CaseNo=ARB/05/13
745,ARB/05/12,Noble Energy Inc. and MachalaPower Cía. Ltd.,Republic of Ecuador and Consejo Nacional de Electricidad,Concluded,https://icsid.worldbank.org/cases/case-database/case-detail?CaseNo=ARB/05/12
746,ARB/05/11,Asset Recovery Trust S.A. ,Argentine Republic ,Concluded,https://icsid.worldbank.org/cases/case-database/case-detail?CaseNo=ARB/05/11
747,ARB/05/9,"Empresa Eléctrica del Ecuador, Inc. (EMELEC) ",Republic of Ecuador ,Concluded,https://icsid.worldbank.org/cases/case-database/case-detail?CaseNo=ARB/05/9
748,ARB/05/7,Saipem S.p.A. ,People's Republic of Bangladesh,Concluded,https://icsid.worldbank.org/cases/case-database/case-detail?CaseNo=ARB/05/7
749,ARB/05/6,Bernardus Henricus Funnekotter and others ,Republic of Zimbabwe ,Concluded,https://icsid.worldbank.org/cases/case-database/case-detail?CaseNo=ARB/05/6
750,ARB/05/5,"TSA Spectrum de Argentina, S.A. ",Argentine Republic ,Concluded,https://icsid.worldbank.org/cases/case-database/case-detail?CaseNo=ARB/05/5
751,ARB/05/4,I&I Beheer B.V. ,Bolivarian Republic of Venezuela ,Concluded,https://icsid.worldbank.org/cases/case-database/case-detail?CaseNo=ARB/05/4
752,ARB/05/3,"LESI, S.p.A. and Astaldi, S.p.A. ",People's Democratic Republic of Algeria,Concluded,https://icsid.worldbank.org/cases/case-database/case-detail?CaseNo=ARB/05/3
753,ARB/05/2,Compañía General de Electricidad S.A. and CGE Argentina S.A. ,Argentine Republic ,Concluded,https://icsid.worldbank.org/cases/case-database/case-detail?CaseNo=ARB/05/2
754,ARB/05/1,Daimler Financial Services AG,Argentine Republic ,Concluded,https://icsid.worldbank.org/cases/case-database/case-detail?CaseNo=ARB/05/1
755,ARB(AF)/04/6,Vannessa Ventures Ltd. ,Bolivarian Republic of Venezuela ,Concluded,https://icsid.worldbank.org/cases/case-database/case-detail?CaseNo=ARB(AF)/04/6
756,ARB/04/19,Duke Energy Electroquil Partners and Electroquil S.A. ,Republic of Ecuador ,Concluded,https://icsid.worldbank.org/cases/case-database/case-detail?CaseNo=ARB/04/19
757,ARB(AF)/04/5,"Archer Daniels Midland Company and Tate & Lyle Ingredients Americas, Inc.",United Mexican States ,Concluded,https://icsid.worldbank.org/cases/case-database/case-detail?CaseNo=ARB(AF)/04/5
758,ARB(AF)/04/4,"Talsud, S.A. ",United Mexican States ,Concluded,https://icsid.worldbank.org/cases/case-database/case-detail?CaseNo=ARB(AF)/04/4
759,ARB(AF)/04/3,"Gemplus, S.A., SLP, S.A. and Gemplus Industrial, S.A. de C.V. ",United Mexican States ,Concluded,https://icsid.worldbank.org/cases/case-database/case-detail?CaseNo=ARB(AF)/04/3
760,ARB/04/16,Mobil Exploration and Development Argentina Inc. Suc. Argentina and Mobil Argentina S.A.,Argentine Republic,Concluded,https://icsid.worldbank.org/cases/case-database/case-detail?CaseNo=ARB/04/16
761,ARB/04/14,Wintershall Aktiengesellschaft ,Argentine Republic,Concluded,https://icsid.worldbank.org/cases/case-database/case-detail?CaseNo=ARB/04/14
762,ARB/04/13,Jan de Nul N.V. and Dredging International N.V. ,Arab Republic of Egypt ,Concluded,https://icsid.worldbank.org/cases/case-database/case-detail?CaseNo=ARB/04/13
763,ARB/04/12,ABCI Investments Limited,Republic of Tunisia ,Pending,https://icsid.worldbank.org/cases/case-database/case-detail?CaseNo=ARB/04/12
764,ARB/04/11,Russell Resources International Limited and others ,Democratic Republic of the Congo,Concluded,https://icsid.worldbank.org/cases/case-database/case-detail?CaseNo=ARB/04/11
765,ARB/04/9,CIT Group Inc. ,Argentine Republic,Concluded,https://icsid.worldbank.org/cases/case-database/case-detail?CaseNo=ARB/04/9
766,ARB/04/8,BP America Production Company and others ,Argentine Republic,Concluded,https://icsid.worldbank.org/cases/case-database/case-detail?CaseNo=ARB/04/8
767,ARB/04/6,OKO Pankki Oyj and others ,Republic of Estonia ,Concluded,https://icsid.worldbank.org/cases/case-database/case-detail?CaseNo=ARB/04/6
768,ARB/04/5,Compagnie d'Exploitation du Chemin de Fer Transgabonais,Gabonese Republic ,Concluded,https://icsid.worldbank.org/cases/case-database/case-detail?CaseNo=ARB/04/5
769,ARB/04/4,SAUR International ,Argentine Republic,Concluded,https://icsid.worldbank.org/cases/case-database/case-detail?CaseNo=ARB/04/4
770,ARB/04/1,Total S.A. ,Argentine Republic,Concluded,https://icsid.worldbank.org/cases/case-database/case-detail?CaseNo=ARB/04/1
771,ARB(AF)/04/1,"Corn Products International, Inc. ",United Mexican States ,Concluded,https://icsid.worldbank.org/cases/case-database/case-detail?CaseNo=ARB(AF)/04/1
772,ARB/03/30,Azurix Corp. ,Argentine Republic,Concluded,https://icsid.worldbank.org/cases/case-database/case-detail?CaseNo=ARB/03/30
773,ARB/03/29,Bayindir Insaat Turizm Ticaret Ve Sanayi A.S. ,Islamic Republic of Pakistan ,Concluded,https://icsid.worldbank.org/cases/case-database/case-detail?CaseNo=ARB/03/29
774,ARB/03/28,Duke Energy International Peru Investments No. 1 Ltd. ,Republic of Peru ,Concluded,https://icsid.worldbank.org/cases/case-database/case-detail?CaseNo=ARB/03/28
775,ARB/03/27,Unisys Corporation ,Argentine Republic,Pending,https://icsid.worldbank.org/cases/case-database/case-detail?CaseNo=ARB/03/27
776,ARB/03/24,Plama Consortium Limited ,Republic of Bulgaria ,Concluded,https://icsid.worldbank.org/cases/case-database/case-detail?CaseNo=ARB/03/24
777,ARB/03/23,"EDF International S.A., SAUR International S.A. and León Participaciones Argentinas S.A. ",Argentine Republic,Concluded,https://icsid.worldbank.org/cases/case-database/case-detail?CaseNo=ARB/03/23
778,ARB/03/22,Electricidad Argentina S.A. and EDF International S.A.,Argentine Republic,Concluded,https://icsid.worldbank.org/cases/case-database/case-detail?CaseNo=ARB/03/22
779,ARB/03/21,Enersis S.A. and others,Argentine Republic,Concluded,https://icsid.worldbank.org/cases/case-database/case-detail?CaseNo=ARB/03/21
780,ARB/03/20,Telefónica S.A,Argentine Republic,Concluded,https://icsid.worldbank.org/cases/case-database/case-detail?CaseNo=ARB/03/20
781,ARB/03/19,"Suez, Sociedad General de Aguas de Barcelona S.A. and Vivendi Universal S.A",Argentine Republic,Concluded,https://icsid.worldbank.org/cases/case-database/case-detail?CaseNo=ARB/03/19
782,ARB/03/17,"Suez, Sociedad General de Aguas de Barcelona S.A. and Interagua Servicios Integrales de Agua S.A.",Argentine Republic,Concluded,https://icsid.worldbank.org/cases/case-database/case-detail?CaseNo=ARB/03/17
783,ARB/03/15,El Paso Energy International Company ,Argentine Republic,Concluded,https://icsid.worldbank.org/cases/case-database/case-detail?CaseNo=ARB/03/15
784,ARB/03/14,Miminco LLC and others,Democratic Republic of the Congo,Concluded,https://icsid.worldbank.org/cases/case-database/case-detail?CaseNo=ARB/03/14
785,ARB/03/13,Pan American Energy LLC and BP Argentina Exploration Company ,Argentine Republic,Concluded,https://icsid.worldbank.org/cases/case-database/case-detail?CaseNo=ARB/03/13
786,ARB/03/10,"Gas Natural SDG, S.A. ",Argentine Republic,Concluded,https://icsid.worldbank.org/cases/case-database/case-detail?CaseNo=ARB/03/10
787,ARB/03/9,Continental Casualty Company ,Argentine Republic,Concluded,https://icsid.worldbank.org/cases/case-database/case-detail?CaseNo=ARB/03/9
788,ARB/03/5,Metalpar S.A. and Buen Aire S.A.,Argentine Republic,Concluded,https://icsid.worldbank.org/cases/case-database/case-detail?CaseNo=ARB/03/5
789,ARB/03/2,Camuzzi International S.A. ,Argentine Republic,Concluded,https://icsid.worldbank.org/cases/case-database/case-detail?CaseNo=ARB/03/2
790,ARB/02/17,AES Corporation ,Argentine Republic,Pending,https://icsid.worldbank.org/cases/case-database/case-detail?CaseNo=ARB/02/17
791,ARB/02/16,Sempra Energy International ,Argentine Republic,Concluded,https://icsid.worldbank.org/cases/case-database/case-detail?CaseNo=ARB/02/16
792,ARB/02/8,Siemens A.G. ,Argentine Republic,Concluded,https://icsid.worldbank.org/cases/case-database/case-detail?CaseNo=ARB/02/8
793,ARB/02/6,SGS Société Générale de Surveillance S.A. ,Republic of the Philippines ,Concluded,https://icsid.worldbank.org/cases/case-database/case-detail?CaseNo=ARB/02/6
