,Case No.,Claimant(s),Respondent(s),Status,Link
323,ARB/14/16,Cyprus Popular Bank Public Co. Ltd.,Hellenic Republic,Pending,https://icsid.worldbank.org/cases/case-database/case-detail?CaseNo=ARB/14/16
324,ARB/14/15,Nusa Tenggara Partnership B.V. and PT Newmont Nusa Tenggara,Republic of Indonesia,Concluded,https://icsid.worldbank.org/cases/case-database/case-detail?CaseNo=ARB/14/15
325,ARB/14/14,EuroGas Inc. and Belmont Resources Inc.,Slovak Republic,Concluded,https://icsid.worldbank.org/cases/case-database/case-detail?CaseNo=ARB/14/14
326,ARB(AF)/14/2,Oded Besserglik,Republic of Mozambique,Concluded,https://icsid.worldbank.org/cases/case-database/case-detail?CaseNo=ARB(AF)/14/2
327,ARB/14/13,Elektrogospodarstvo Slovenije - razvoj in inzeniring d.o.o.,Bosnia and Herzegovina,Pending,https://icsid.worldbank.org/cases/case-database/case-detail?CaseNo=ARB/14/13
328,UNCT/14/2,Eli Lilly and Company,Canada,Concluded,https://icsid.worldbank.org/cases/case-database/case-detail?CaseNo=UNCT/14/2
329,ARB/14/12,InfraRed Environmental Infrastructure GP Limited and others ,Kingdom of Spain ,Pending,https://icsid.worldbank.org/cases/case-database/case-detail?CaseNo=ARB/14/12
330,ARB/14/11,NextEra Energy Global Holdings B.V. and NextEra Energy Spain Holdings B.V.,Kingdom of Spain,Pending,https://icsid.worldbank.org/cases/case-database/case-detail?CaseNo=ARB/14/11
331,ARB/14/10,"Highbury International AVV, Compañía Minera de Bajo Caroní AVV, and Ramstein Trading Inc.",Bolivarian Republic of Venezuela,Concluded,https://icsid.worldbank.org/cases/case-database/case-detail?CaseNo=ARB/14/10
332,ARB/14/9,"City-State N.V., Praktyka Asset Management Company LLC, Crystal-Invest LLC and Prodiz LLC",Ukraine,Concluded,https://icsid.worldbank.org/cases/case-database/case-detail?CaseNo=ARB/14/9
333,ARB(AF)/14/1,Anglo American PLC,Bolivarian Republic of Venezuela,Concluded,https://icsid.worldbank.org/cases/case-database/case-detail?CaseNo=ARB(AF)/14/1
334,ARB/14/8,CEAC Holdings Limited,Montenegro,Concluded,https://icsid.worldbank.org/cases/case-database/case-detail?CaseNo=ARB/14/8
335,ARB/14/7,African Petroleum Gambia Limited (Block A4),Republic of The Gambia,Concluded,https://icsid.worldbank.org/cases/case-database/case-detail?CaseNo=ARB/14/7
336,ARB/14/6,African Petroleum Gambia Limited (Block A1),Republic of The Gambia,Concluded,https://icsid.worldbank.org/cases/case-database/case-detail?CaseNo=ARB/14/6
337,ARB/14/5,Infinito Gold Ltd.,Republic of Costa Rica,Pending,https://icsid.worldbank.org/cases/case-database/case-detail?CaseNo=ARB/14/5
338,ARB/14/4,"Unión Fenosa Gas, S.A.",Arab Republic of Egypt,Pending,https://icsid.worldbank.org/cases/case-database/case-detail?CaseNo=ARB/14/4
339,ARB/14/3,"Blusun S.A., Jean-Pierre Lecorcier and Michael Stein",Italian Republic,Concluded,https://icsid.worldbank.org/cases/case-database/case-detail?CaseNo=ARB/14/3
340,ARB/14/2,Michael Dagher,Republic of the Sudan,Concluded,https://icsid.worldbank.org/cases/case-database/case-detail?CaseNo=ARB/14/2
341,ARB/14/1,Masdar Solar & Wind Cooperatief U.A.,Kingdom of Spain,Pending,https://icsid.worldbank.org/cases/case-database/case-detail?CaseNo=ARB/14/1
342,ARB/13/38,"Fouad Alghanim & Sons Co. for General Trading & Contracting, W.L.L. and Fouad Mohammed Thunyan Alghanim",Hashemite Kingdom of Jordan ,Concluded,https://icsid.worldbank.org/cases/case-database/case-detail?CaseNo=ARB/13/38
343,ARB/13/37,"Utsch M.O.V.E.R.S. International GmbH, Erich Utsch Aktiengesellschaft, and Helmut Jungbluth",Arab Republic of Egypt,Concluded,https://icsid.worldbank.org/cases/case-database/case-detail?CaseNo=ARB/13/37
344,ARB/13/36,Eiser Infrastructure Limited and Energía Solar Luxembourg S.à r.l.,Kingdom of Spain,Pending,https://icsid.worldbank.org/cases/case-database/case-detail?CaseNo=ARB/13/36
345,ARB/13/35,UP and C.D Holding Internationale,Hungary,Pending,https://icsid.worldbank.org/cases/case-database/case-detail?CaseNo=ARB/13/35
346,ARB/13/34,Courts (Indian Ocean) Limited and Courts Madagascar S.A.R.L.,Republic of Madagascar,Concluded,https://icsid.worldbank.org/cases/case-database/case-detail?CaseNo=ARB/13/34
347,ARB/13/33,PNG Sustainable Development Program Ltd.,Independent State of Papua New Guinea ,Concluded,https://icsid.worldbank.org/cases/case-database/case-detail?CaseNo=ARB/13/33
348,ARB/13/32,MOL Hungarian Oil and Gas Company Plc,Republic of Croatia,Pending,https://icsid.worldbank.org/cases/case-database/case-detail?CaseNo=ARB/13/32
349,ARB/13/31,Infrastructure Services Luxembourg S.à.r.l. and Energia Termosolar B.V. (formerly Antin Infrastructure Services Luxembourg S.à.r.l. and Antin Energia Termosolar B.V.),Kingdom of Spain,Pending,https://icsid.worldbank.org/cases/case-database/case-detail?CaseNo=ARB/13/31
350,ARB/13/30,RREEF Infrastructure (G.P.) Limited and RREEF Pan-European Infrastructure Two Lux S.à r.l.,Kingdom of Spain,Pending,https://icsid.worldbank.org/cases/case-database/case-detail?CaseNo=ARB/13/30
351,ARB/13/29,Cementos La Union S.A. and Aridos Jativa S.L.U,Arab Republic of Egypt,Pending,https://icsid.worldbank.org/cases/case-database/case-detail?CaseNo=ARB/13/29
352,ARB(AF)/13/2,"Cemusa - Corporación Europea de Mobiliario Urbano, S.A. and Corporación Americana de Equipamientos Urbanos, S.L.",United Mexican States,Concluded,https://icsid.worldbank.org/cases/case-database/case-detail?CaseNo=ARB(AF)/13/2
353,UNCT/13/2,"Aaron C.Berkowitz, Brett E. Berkowitz and Trevor B. Berkowitz",Republic of Costa Rica,Concluded,https://icsid.worldbank.org/cases/case-database/case-detail?CaseNo=UNCT/13/2
354,ARB/13/28,"Transglobal Green Energy, LLC and Transglobal Green Panama, S.A. ",Republic of Panama ,Concluded,https://icsid.worldbank.org/cases/case-database/case-detail?CaseNo=ARB/13/28
355,ARB/13/27,"Marfin Investment Group Holdings S.A., Alexandros Bakatselos and others ",Republic of Cyprus,Concluded,https://icsid.worldbank.org/cases/case-database/case-detail?CaseNo=ARB/13/27
356,ARB/13/26,"Spentex Netherlands, B.V.",Republic of Uzbekistan,Concluded,https://icsid.worldbank.org/cases/case-database/case-detail?CaseNo=ARB/13/26
357,ARB/13/25,Tullow Uganda Operations Pty Ltd and Tullow Uganda Limited,Republic of Uganda,Concluded,https://icsid.worldbank.org/cases/case-database/case-detail?CaseNo=ARB/13/25
358,ARB/13/24,Republic of Peru,Caravelí Cotaruse Transmisora de Energía S.A.C.,Concluded,https://icsid.worldbank.org/cases/case-database/case-detail?CaseNo=ARB/13/24
359,ARB/13/23,ASA International S.p.A.,Arab Republic of Egypt,Concluded,https://icsid.worldbank.org/cases/case-database/case-detail?CaseNo=ARB/13/23
360,ARB/13/22,Erbil Serter,French Republic,Concluded,https://icsid.worldbank.org/cases/case-database/case-detail?CaseNo=ARB/13/22
361,ARB/13/21,Edenred S.A.,Hungary,Concluded,https://icsid.worldbank.org/cases/case-database/case-detail?CaseNo=ARB/13/21
362,ARB/13/20,Interocean Oil Development Company and Interocean Oil Exploration Company,Federal Republic of Nigeria,Pending,https://icsid.worldbank.org/cases/case-database/case-detail?CaseNo=ARB/13/20
363,ARB/13/19,Güneş Tekstil Konfeksiyon Sanayi ve Ticaret Limited Şirketi and others,Republic of Uzbekistan,Pending,https://icsid.worldbank.org/cases/case-database/case-detail?CaseNo=ARB/13/19
364,UNCT/13/1,"The Renco Group, Inc.",Republic of Peru,Concluded,https://icsid.worldbank.org/cases/case-database/case-detail?CaseNo=UNCT/13/1
365,ARB/13/18,Enel Green Power S.p.A.,Republic of El Salvador,Concluded,https://icsid.worldbank.org/cases/case-database/case-detail?CaseNo=ARB/13/18
366,ARB/13/17,EVN AG,Republic of Bulgaria ,Concluded,https://icsid.worldbank.org/cases/case-database/case-detail?CaseNo=ARB/13/17
367,ARB/13/16,Société des Mines de Loulo S.A.,Republic of Mali,Concluded,https://icsid.worldbank.org/cases/case-database/case-detail?CaseNo=ARB/13/16
368,ARB/13/15,Lundin Tunisia B.V.,Republic of Tunisia ,Concluded,https://icsid.worldbank.org/cases/case-database/case-detail?CaseNo=ARB/13/15
369,ARB/13/14,RSM Production Company,Republic of Cameroon,Concluded,https://icsid.worldbank.org/cases/case-database/case-detail?CaseNo=ARB/13/14
370,ARB/13/13,Caratube International Oil Company LLP and Devincci Salah Hourani,Republic of Kazakhstan,Concluded,https://icsid.worldbank.org/cases/case-database/case-detail?CaseNo=ARB/13/13
371,ARB/13/12,"Lieven J. van Riet, Chantal C. van Riet and Christopher van Riet",Republic of Croatia ,Concluded,https://icsid.worldbank.org/cases/case-database/case-detail?CaseNo=ARB/13/12
372,ARB/13/11,"Valores Mundiales, S.L. and Consorcio Andino S.L.",Bolivarian Republic of Venezuela,Pending,https://icsid.worldbank.org/cases/case-database/case-detail?CaseNo=ARB/13/11
373,ARB/13/10,"Impresa Grassetto S. p. A., in liquidation",Republic of Slovenia ,Concluded,https://icsid.worldbank.org/cases/case-database/case-detail?CaseNo=ARB/13/10
374,ARB/13/9,Federal Elektrik Yatırım ve Ticaret A.Ş. and others,Republic of Uzbekistan,Concluded,https://icsid.worldbank.org/cases/case-database/case-detail?CaseNo=ARB/13/9
375,ARB/13/7,Joseph Houben,Republic of Burundi,Concluded,https://icsid.worldbank.org/cases/case-database/case-detail?CaseNo=ARB/13/7
376,ARB/13/8,"Poštová banka, a.s. and ISTROKAPITAL SE",Hellenic Republic,Concluded,https://icsid.worldbank.org/cases/case-database/case-detail?CaseNo=ARB/13/8
377,ARB/13/6,Vladislav Kim and others,Republic of Uzbekistan,Pending,https://icsid.worldbank.org/cases/case-database/case-detail?CaseNo=ARB/13/6
378,ARB(AF)/13/1,Consolidated Exploration Holdings Ltd. and others,Kyrgyz Republic,Concluded,https://icsid.worldbank.org/cases/case-database/case-detail?CaseNo=ARB(AF)/13/1
379,ARB/13/5,Ossama Al Sharif ,Arab Republic of Egypt,Concluded,https://icsid.worldbank.org/cases/case-database/case-detail?CaseNo=ARB/13/5
380,ARB/13/4,Ossama Al Sharif,Arab Republic of Egypt ,Concluded,https://icsid.worldbank.org/cases/case-database/case-detail?CaseNo=ARB/13/4
381,ARB/13/3,Ossama Al Sharif ,Arab Republic of Egypt ,Concluded,https://icsid.worldbank.org/cases/case-database/case-detail?CaseNo=ARB/13/3
382,ARB/13/2,Cervin Investissements S.A. and Rhone Investissements S.A.,Republic of Costa Rica,Concluded,https://icsid.worldbank.org/cases/case-database/case-detail?CaseNo=ARB/13/2
383,ARB/13/1,Karkey Karadeniz Elektrik Uretim A.S.,Islamic Republic of Pakistan,Concluded,https://icsid.worldbank.org/cases/case-database/case-detail?CaseNo=ARB/13/1
384,ARB/12/40 and 12/14,"Churchill Mining Plc and Planet Mining Pty Ltd, formerly ARB/12/40",Republic of Indonesia,Concluded,https://icsid.worldbank.org/cases/case-database/case-detail?CaseNo=ARB/12/40 and 12/14
385,ARB/12/38,"Repsol, S.A. and Repsol Butano, S.A.",Argentine Republic,Concluded,https://icsid.worldbank.org/cases/case-database/case-detail?CaseNo=ARB/12/38
386,ARB/12/37,LSF-KEB Holdings SCA and others,Republic of Korea,Pending,https://icsid.worldbank.org/cases/case-database/case-detail?CaseNo=ARB/12/37
387,ARB(AF)/12/8,MNSS B.V. and Recupero Credito Acciaio N.V.,Montenegro,Concluded,https://icsid.worldbank.org/cases/case-database/case-detail?CaseNo=ARB(AF)/12/8
388,ARB/12/36,Société Civile Immobilière de Gaëta,Republic of Guinea,Concluded,https://icsid.worldbank.org/cases/case-database/case-detail?CaseNo=ARB/12/36
389,ARB/12/35,Orascom TMT Investments S.à r.l.,People's Democratic Republic of Algeria,Pending,https://icsid.worldbank.org/cases/case-database/case-detail?CaseNo=ARB/12/35
390,ARB(AF)/12/7,Mobile TeleSystems OJSC,Republic of Uzbekistan,Concluded,https://icsid.worldbank.org/cases/case-database/case-detail?CaseNo=ARB(AF)/12/7
391,ARB/12/34,Tullow Uganda Operations PTY LTD,Republic of Uganda,Pending,https://icsid.worldbank.org/cases/case-database/case-detail?CaseNo=ARB/12/34
392,ARB/12/33,UAB E energija (Lithuania),Republic of Latvia,Concluded,https://icsid.worldbank.org/cases/case-database/case-detail?CaseNo=ARB/12/33
393,ARB/12/32,Gelsenwasser AG,People's Democratic Republic of Algeria,Concluded,https://icsid.worldbank.org/cases/case-database/case-detail?CaseNo=ARB/12/32
394,ARB/12/31,"Guardian Fiduciary Trust, Ltd, f/k/a Capital Conservator Savings & Loan, Ltd","Macedonia, former Yugoslav Republic of",Concluded,https://icsid.worldbank.org/cases/case-database/case-detail?CaseNo=ARB/12/31
395,ARB/12/30,Lundin Tunisia B. V.,Republic of Tunisia ,Concluded,https://icsid.worldbank.org/cases/case-database/case-detail?CaseNo=ARB/12/30
396,ARB/12/29,"Ping An Life Insurance Company of China, Limited and Ping An Insurance (Group) Company of China, Limited",Kingdom of Belgium,Concluded,https://icsid.worldbank.org/cases/case-database/case-detail?CaseNo=ARB/12/29
397,ARB(AF)/12/6,Lao Holdings N.V. ,Lao People’s Democratic Republic ,Concluded,https://icsid.worldbank.org/cases/case-database/case-detail?CaseNo=ARB(AF)/12/6
398,ARB/12/28,Pluspetrol Perú Corporation and others,Perupetro S.A. ,Concluded,https://icsid.worldbank.org/cases/case-database/case-detail?CaseNo=ARB/12/28
399,ARB/12/27,Bidzina Ivanishvili,Georgia,Concluded,https://icsid.worldbank.org/cases/case-database/case-detail?CaseNo=ARB/12/27
400,ARB/12/26,Sudapet Company Limited,Republic of South Sudan,Concluded,https://icsid.worldbank.org/cases/case-database/case-detail?CaseNo=ARB/12/26
401,ARB/12/25,Marco Gavazzi and Stefano Gavazzi ,Romania,Concluded,https://icsid.worldbank.org/cases/case-database/case-detail?CaseNo=ARB/12/25
402,ARB/12/24,Transban Investments Corp.,Bolivarian Republic of Venezuela,Concluded,https://icsid.worldbank.org/cases/case-database/case-detail?CaseNo=ARB/12/24
403,ARB/12/23,Tenaris S.A. and Talta - Trading e Marketing Sociedade Unipessoal Lda.,Bolivarian Republic of Venezuela,Concluded,https://icsid.worldbank.org/cases/case-database/case-detail?CaseNo=ARB/12/23
404,ARB/12/22,Venoklim Holding B.V.,Bolivarian Republic of Venezuela,Concluded,https://icsid.worldbank.org/cases/case-database/case-detail?CaseNo=ARB/12/22
405,ARB/12/21,"Fábrica de Vidrios Los Andes, C.A. and Owens-Illinois de Venezuela, C.A.",Bolivarian Republic of Venezuela,Concluded,https://icsid.worldbank.org/cases/case-database/case-detail?CaseNo=ARB/12/21
406,ARB/12/20,Blue Bank International & Trust (Barbados) Ltd.,Bolivarian Republic of Venezuela,Concluded,https://icsid.worldbank.org/cases/case-database/case-detail?CaseNo=ARB/12/20
407,ARB/12/19,Ternium S.A. and Consorcio Siderurgia Amazonia S.L.,Bolivarian Republic of Venezuela,Concluded,https://icsid.worldbank.org/cases/case-database/case-detail?CaseNo=ARB/12/19
408,ARB(AF)/12/5,Rusoro Mining Ltd.,Bolivarian Republic of Venezuela,Concluded,https://icsid.worldbank.org/cases/case-database/case-detail?CaseNo=ARB(AF)/12/5
409,ARB/12/18,Valle Verde Sociedad Financiera S.L. ,Bolivarian Republic of Venezuela,Concluded,https://icsid.worldbank.org/cases/case-database/case-detail?CaseNo=ARB/12/18
410,ARB/12/17,"Inversión y Gestión de Bienes, IGB, S.L. and IGB18 Las Rozas, S.L.",Kingdom of Spain ,Concluded,https://icsid.worldbank.org/cases/case-database/case-detail?CaseNo=ARB/12/17
411,ARB/12/16,"Novera AD, Novera Properties B.V. and Novera Properties N.V.",Republic of Bulgaria,Concluded,https://icsid.worldbank.org/cases/case-database/case-detail?CaseNo=ARB/12/16
412,CONC(AF)/12/2,Republic of Equatorial Guinea,CMS Energy Corporation and others ,Concluded,https://icsid.worldbank.org/cases/case-database/case-detail?CaseNo=CONC(AF)/12/2
413,ARB/12/15,Veolia Propreté,Arab Republic of Egypt,Concluded,https://icsid.worldbank.org/cases/case-database/case-detail?CaseNo=ARB/12/15
414,ARB/12/14 and 12/40,"Churchill Mining Plc and Planet Mining Pty Ltd, formerly ARB/12/14",Republic of Indonesia,Concluded,https://icsid.worldbank.org/cases/case-database/case-detail?CaseNo=ARB/12/14 and 12/40
415,ARB(AF)/12/4,Telefónica S.A. ,United Mexican States ,Concluded,https://icsid.worldbank.org/cases/case-database/case-detail?CaseNo=ARB(AF)/12/4
416,ARB/12/13,Saint-Gobain Performance Plastics Europe,Bolivarian Republic of Venezuela,Concluded,https://icsid.worldbank.org/cases/case-database/case-detail?CaseNo=ARB/12/13
417,ARB/12/12,Vattenfall AB and others,Federal Republic of Germany ,Pending,https://icsid.worldbank.org/cases/case-database/case-detail?CaseNo=ARB/12/12
418,ARB/12/11,Ampal-American Israel Corporation and others,Arab Republic of Egypt,Concluded,https://icsid.worldbank.org/cases/case-database/case-detail?CaseNo=ARB/12/11
419,ARB(AF)/12/3,"Mercer International, Inc.",Canada,Concluded,https://icsid.worldbank.org/cases/case-database/case-detail?CaseNo=ARB(AF)/12/3
420,CONC(AF)/12/1,"Hess Equatorial Guinea, Inc. and Tullow Equatorial Guinea Limited",Republic of Equatorial Guinea,Pending,https://icsid.worldbank.org/cases/case-database/case-detail?CaseNo=CONC(AF)/12/1
421,ARB/12/10,RSM Production Corporation,Saint Lucia,Concluded,https://icsid.worldbank.org/cases/case-database/case-detail?CaseNo=ARB/12/10
422,ARB/12/9,Dan Cake (Portugal) S.A.,Hungary ,Pending,https://icsid.worldbank.org/cases/case-database/case-detail?CaseNo=ARB/12/9
423,ARB/12/8,Société Industrielle des Boissons de Guinée,Republic of Guinea,Concluded,https://icsid.worldbank.org/cases/case-database/case-detail?CaseNo=ARB/12/8
424,ARB/12/7,"Slovak Gas Holding BV, GDF International SAS and E.ON Ruhrgas International GmbH",Slovak Republic,Concluded,https://icsid.worldbank.org/cases/case-database/case-detail?CaseNo=ARB/12/7
425,ARB/12/6,Muhammet Ҫap & Bankrupt Sehil Inşaat  Endustri ve Ticaret Ltd. Sti. ,Turkmenistan,Pending,https://icsid.worldbank.org/cases/case-database/case-detail?CaseNo=ARB/12/6
426,ARB(AF)/12/2,Grupo Francisco Hernando Contreras,Republic of Equatorial Guinea,Concluded,https://icsid.worldbank.org/cases/case-database/case-detail?CaseNo=ARB(AF)/12/2
427,ARB(AF)/12/1,Apotex Holdings Inc. and Apotex Inc. ,United States of America,Concluded,https://icsid.worldbank.org/cases/case-database/case-detail?CaseNo=ARB(AF)/12/1
428,ARB/12/5,Isolux Corsán Concesiones S.A.,Republic of Peru,Concluded,https://icsid.worldbank.org/cases/case-database/case-detail?CaseNo=ARB/12/5
429,ARB/12/4,Supervision y Control S.A.,Republic of Costa Rica,Concluded,https://icsid.worldbank.org/cases/case-database/case-detail?CaseNo=ARB/12/4
430,ARB/12/3,Accession Mezzanine Capital L.P. and Danubius Kereskedöház Vagyonkezelö Zrt.,Hungary ,Concluded,https://icsid.worldbank.org/cases/case-database/case-detail?CaseNo=ARB/12/3
431,ARB/12/2,"Emmis International Holding, B.V., Emmis Radio Operating, B.V., and MEM Magyar Electronic Media Kereskedelmi és Szolgáltató Kft.",Hungary ,Concluded,https://icsid.worldbank.org/cases/case-database/case-detail?CaseNo=ARB/12/2
432,ARB/11/33,Adel A Hamadi Al Tamimi,Sultanate of Oman,Concluded,https://icsid.worldbank.org/cases/case-database/case-detail?CaseNo=ARB/11/33
433,ARB/11/32,Indorama International Finance Limited,Arab Republic of Egypt,Concluded,https://icsid.worldbank.org/cases/case-database/case-detail?CaseNo=ARB/11/32
434,ARB/11/31,"Gambrinus, Corp.",Bolivarian Republic of Venezuela,Concluded,https://icsid.worldbank.org/cases/case-database/case-detail?CaseNo=ARB/11/31
435,ARB/11/30,Hortensia Margarita Shortt,Bolivarian Republic of Venezuela,Concluded,https://icsid.worldbank.org/cases/case-database/case-detail?CaseNo=ARB/11/30
436,ARB/11/29,Getma International and others,Republic of Guinea,Concluded,https://icsid.worldbank.org/cases/case-database/case-detail?CaseNo=ARB/11/29
437,ARB/11/28,Tulip Real Estate and Development Netherlands B.V. ,Republic of Turkey,Concluded,https://icsid.worldbank.org/cases/case-database/case-detail?CaseNo=ARB/11/28
438,ARB/11/27,Baggerwerken Decloedt En Zoon NV,Republic of the Philippines,Concluded,https://icsid.worldbank.org/cases/case-database/case-detail?CaseNo=ARB/11/27
439,ARB(AF)/11/4,Mobile TeleSystems OJSC,Turkmenistan,Concluded,https://icsid.worldbank.org/cases/case-database/case-detail?CaseNo=ARB(AF)/11/4
440,ARB/11/26,Tenaris S.A. and Talta - Trading e Marketing Sociedade Unipessoal Lda.,Bolivarian Republic of Venezuela,Concluded,https://icsid.worldbank.org/cases/case-database/case-detail?CaseNo=ARB/11/26
441,ARB/11/25,OI European Group B.V.,Bolivarian Republic of Venezuela,Concluded,https://icsid.worldbank.org/cases/case-database/case-detail?CaseNo=ARB/11/25
442,CONC/11/1,RSM Production Corporation,Republic of Cameroon ,Concluded,https://icsid.worldbank.org/cases/case-database/case-detail?CaseNo=CONC/11/1
443,ARB/11/24,Mamidoil Jetoil Greek Petroleum Products Societe Anonyme S.A. ,Republic of Albania,Concluded,https://icsid.worldbank.org/cases/case-database/case-detail?CaseNo=ARB/11/24
444,ARB/11/23,Franck Charles Arif,Republic of Moldova,Concluded,https://icsid.worldbank.org/cases/case-database/case-detail?CaseNo=ARB/11/23
445,ARB/11/22,Vigotop Limited,Hungary ,Concluded,https://icsid.worldbank.org/cases/case-database/case-detail?CaseNo=ARB/11/22
446,ARB/11/21,"DP World Callao S.R.L., P&O Dover (Holding) Limited, and The Peninsular and Oriental Steam Navigation Company",Republic of Peru,Concluded,https://icsid.worldbank.org/cases/case-database/case-detail?CaseNo=ARB/11/21
447,ARB/11/20,Garanti Koza LLP,Turkmenistan,Concluded,https://icsid.worldbank.org/cases/case-database/case-detail?CaseNo=ARB/11/20
448,ARB/11/19,Koch Minerals Sàrl and Koch Nitrogen International Sàrl,Bolivarian Republic of Venezuela,Pending,https://icsid.worldbank.org/cases/case-database/case-detail?CaseNo=ARB/11/19
449,ARB/11/18,Burimi SRL and Eagle Games SH.A,Republic of Albania ,Concluded,https://icsid.worldbank.org/cases/case-database/case-detail?CaseNo=ARB/11/18
450,ARB/11/17,Renée Rose Levy and Gremcitel S.A.,Republic of Peru,Concluded,https://icsid.worldbank.org/cases/case-database/case-detail?CaseNo=ARB/11/17
451,ARB/11/16,"Hussain Sajwani, Damac Park Avenue for Real Estate Development S.A.E., and Damac Gamsha Bay for Development S.A.E.",Arab Republic of Egypt,Concluded,https://icsid.worldbank.org/cases/case-database/case-detail?CaseNo=ARB/11/16
452,ARB/11/15,Ekran Berhad,People's Republic of China,Concluded,https://icsid.worldbank.org/cases/case-database/case-detail?CaseNo=ARB/11/15
453,ARB/11/14,"Diamond Fields Liberia, Inc.",Republic of Liberia ,Concluded,https://icsid.worldbank.org/cases/case-database/case-detail?CaseNo=ARB/11/14
454,ARB/11/13,Rafat Ali Rizvi,Republic of Indonesia,Concluded,https://icsid.worldbank.org/cases/case-database/case-detail?CaseNo=ARB/11/13
455,ARB/11/12,Fraport AG Frankfurt Airport Services Worldwide,Republic of the Philippines,Concluded,https://icsid.worldbank.org/cases/case-database/case-detail?CaseNo=ARB/11/12
456,ARB(AF)/11/3,"Vincent J. Ryan, Schooner Capital LLC, and Atlantic Investment Partners LLC",Republic of Poland ,Concluded,https://icsid.worldbank.org/cases/case-database/case-detail?CaseNo=ARB(AF)/11/3
457,ARB/11/11,AHS Niger and Menzies Middle East and Africa S.A. ,Republic of Niger,Concluded,https://icsid.worldbank.org/cases/case-database/case-detail?CaseNo=ARB/11/11
458,ARB/11/10,"The Williams Companies, International Holdings B.V., WilPro Energy Services (El Furrial) Limited and WilPro Energy Services (Pigap II) Limited",Bolivarian Republic of Venezuela,Concluded,https://icsid.worldbank.org/cases/case-database/case-detail?CaseNo=ARB/11/10
459,ARB/11/9,Caravelí Cotaruse Transmisora de Energía S.A.C.,Republic of Peru ,Concluded,https://icsid.worldbank.org/cases/case-database/case-detail?CaseNo=ARB/11/9
460,ARB/11/8,Agility for Public Warehousing Company K.S.C.,Islamic Republic of Pakistan,Concluded,https://icsid.worldbank.org/cases/case-database/case-detail?CaseNo=ARB/11/8
461,ARB/11/7,National Gas S.A.E.,Arab Republic of Egypt,Concluded,https://icsid.worldbank.org/cases/case-database/case-detail?CaseNo=ARB/11/7
462,ARB/11/6,Bawabet Al Kuwait Holding Company ,Arab Republic of Egypt,Concluded,https://icsid.worldbank.org/cases/case-database/case-detail?CaseNo=ARB/11/6
463,ARB(AF)/11/2,Crystallex International Corporation,Bolivarian Republic of Venezuela,Concluded,https://icsid.worldbank.org/cases/case-database/case-detail?CaseNo=ARB(AF)/11/2
464,ARB/11/5,Longreef Investments A.V.V.,Bolivarian Republic of Venezuela,Pending,https://icsid.worldbank.org/cases/case-database/case-detail?CaseNo=ARB/11/5
465,ARB(AF)/11/1,Nova Scotia Power Incorporated,Bolivarian Republic of Venezuela,Concluded,https://icsid.worldbank.org/cases/case-database/case-detail?CaseNo=ARB(AF)/11/1
466,ARB/11/4,Club Hotel Loutraki S.A. and Casinos Austria International Holding GMBH,Republic of Serbia,Concluded,https://icsid.worldbank.org/cases/case-database/case-detail?CaseNo=ARB/11/4
467,ARB/11/3,Accession Eastern Europe Capital AB and Mezzanine Management Sweden AB,Republic of Bulgaria,Concluded,https://icsid.worldbank.org/cases/case-database/case-detail?CaseNo=ARB/11/3
468,ARB/11/2,Türkiye Petrolleri Anonim Ortaklığı ,Republic of Kazakhstan ,Concluded,https://icsid.worldbank.org/cases/case-database/case-detail?CaseNo=ARB/11/2
469,ARB/11/1,Highbury International AVV and Ramstein Trading Inc.,Bolivarian Republic of Venezuela,Concluded,https://icsid.worldbank.org/cases/case-database/case-detail?CaseNo=ARB/11/1
470,ARB/10/25,"Border Timbers Limited, Timber Products International (Private) Limited, and Hangani Development Co. (Private) Limited",Republic of Zimbabwe,Concluded,https://icsid.worldbank.org/cases/case-database/case-detail?CaseNo=ARB/10/25
471,ARB/10/24,İçkale İnşaat Limited Şirketi ,Turkmenistan,Concluded,https://icsid.worldbank.org/cases/case-database/case-detail?CaseNo=ARB/10/24
472,ARB/10/23,"TECO Guatemala Holdings, LLC",Republic of Guatemala,Pending,https://icsid.worldbank.org/cases/case-database/case-detail?CaseNo=ARB/10/23
473,ARB/10/22,Ömer Dede and Serdar Elhüseyni,Romania ,Concluded,https://icsid.worldbank.org/cases/case-database/case-detail?CaseNo=ARB/10/22
474,ARB/10/21,"International Quantum Resources Limited, Frontier SPRL and Compagnie Minière de Sakania SPRL",Democratic Republic of the Congo,Concluded,https://icsid.worldbank.org/cases/case-database/case-detail?CaseNo=ARB/10/21
