,Case No.,Claimant(s),Respondent(s),Status,Link
161,ARB/17/28,LTME Mauritius Limited and Madamobil Holdings Mauritius Limited,Republic of Madagascar,Pending,https://icsid.worldbank.org/cases/case-database/case-detail?CaseNo=ARB/17/28
162,ARB/17/27,"Magyar Farming Company Ltd, Kintyre Kft and Inicia Zrt",Hungary,Pending,https://icsid.worldbank.org/cases/case-database/case-detail?CaseNo=ARB/17/27
163,ARB/17/26,Puma Energy PNG Supply Ltd and Puma Energy PNG Refining Limited,Independent State of Papua New Guinea,Concluded,https://icsid.worldbank.org/cases/case-database/case-detail?CaseNo=ARB/17/26
164,ARB/17/25,Mabco Constructions SA,Republic of Kosovo,Pending,https://icsid.worldbank.org/cases/case-database/case-detail?CaseNo=ARB/17/25
165,ARB/17/24,"Bursel Tekstil Sanayi Ve Diş Ticaret A.Ş., Burhan Enuştekin and Selim Kaptanoğlu",Republic of Uzbekistan,Pending,https://icsid.worldbank.org/cases/case-database/case-detail?CaseNo=ARB/17/24
166,ARB/17/23,"CMC Muratori Cementisti CMC Di Ravenna SOC. Coop., CMC MuratoriCementisti CMC Di Ravenna SOC. Coop. A.R.L. Maputo Branch and CMC Africa, and CMC Africa Austral, LDA",Republic of Mozambique,Concluded,https://icsid.worldbank.org/cases/case-database/case-detail?CaseNo=ARB/17/23
167,ARB/17/22,Big Sky Energy Corporation,Republic of Kazakhstan,Pending,https://icsid.worldbank.org/cases/case-database/case-detail?CaseNo=ARB/17/22
168,ARB/17/21,DP World PLC,Kingdom of Belgium,Pending,https://icsid.worldbank.org/cases/case-database/case-detail?CaseNo=ARB/17/21
169,ARB/17/20,BM Mühendislik ve İnşaat A.Ş.,United Arab Emirates,Pending,https://icsid.worldbank.org/cases/case-database/case-detail?CaseNo=ARB/17/20
170,UNCT/17/1,Joshua Dean Nelson,United Mexican States,Concluded,https://icsid.worldbank.org/cases/case-database/case-detail?CaseNo=UNCT/17/1
171,ARB/17/19,Hela Schwarz GmbH,People's Republic of China ,Pending,https://icsid.worldbank.org/cases/case-database/case-detail?CaseNo=ARB/17/19
172,ARB/17/18,"(DS)2, S.A., Peter de Sutter and Kristof De Sutter ",Republic of Madagascar,Pending,https://icsid.worldbank.org/cases/case-database/case-detail?CaseNo=ARB/17/18
173,ARB/17/17,"MetLife, Inc., MetLife Servicios S.A. and MetLife Seguros de Retiro S.A.",Argentine Republic,Pending,https://icsid.worldbank.org/cases/case-database/case-detail?CaseNo=ARB/17/17
174,ARB/17/16,Carlos Rios and Francisco Javier Rios,Republic of Chile,Pending,https://icsid.worldbank.org/cases/case-database/case-detail?CaseNo=ARB/17/16
175,ARB/17/15,Portigon AG,Kingdom of Spain,Pending,https://icsid.worldbank.org/cases/case-database/case-detail?CaseNo=ARB/17/15
176,ARB/17/14,"Rockhopper Italia S.p.A., Rockhopper Mediterranean Ltd, and Rockhopper Exploration Plc",Italian Republic,Pending,https://icsid.worldbank.org/cases/case-database/case-detail?CaseNo=ARB/17/14
177,ARB/17/13,"Grenada Private Power Limited and WRB Enterprises, Inc.",Grenada,Concluded,https://icsid.worldbank.org/cases/case-database/case-detail?CaseNo=ARB/17/13
178,ARB/17/12,Jochem Bernard Buse,Republic of Panama,Pending,https://icsid.worldbank.org/cases/case-database/case-detail?CaseNo=ARB/17/12
179,ARB/17/11,Pawlowski AG and Project Sever s.r.o.,Czech Republic,Pending,https://icsid.worldbank.org/cases/case-database/case-detail?CaseNo=ARB/17/11
180,ADHOC/17/1,Sanum Investments Limited,Lao People’s Democratic Republic,Pending,https://icsid.worldbank.org/cases/case-database/case-detail?CaseNo=ADHOC/17/1
181,ARB/17/10,Itisaluna Iraq LLC and others ,Republic of Iraq,Concluded,https://icsid.worldbank.org/cases/case-database/case-detail?CaseNo=ARB/17/10
182,ARB/17/9,"Lidercón, S.L.",Republic of Peru,Concluded,https://icsid.worldbank.org/cases/case-database/case-detail?CaseNo=ARB/17/9
183,ARB/17/8,"Rizzani de Eccher S.p.A., Obrascón Huarte Lain S.A. and Trevi S.p.A.",State of Kuwait,Pending,https://icsid.worldbank.org/cases/case-database/case-detail?CaseNo=ARB/17/8
184,ARB/17/7,Agility Public Warehousing Company K.S.C.,Republic of Iraq,Pending,https://icsid.worldbank.org/cases/case-database/case-detail?CaseNo=ARB/17/7
185,ARB/17/6,Anglo-Adriatic Group Limited,Republic of Albania,Concluded,https://icsid.worldbank.org/cases/case-database/case-detail?CaseNo=ARB/17/6
186,ARB/17/5,Eugene Kazmin,Republic of Latvia,Pending,https://icsid.worldbank.org/cases/case-database/case-detail?CaseNo=ARB/17/5
187,ARB/17/4,Bank of Cyprus Public Company Limited,Hellenic Republic,Concluded,https://icsid.worldbank.org/cases/case-database/case-detail?CaseNo=ARB/17/4
188,ARB/17/3,Metro de Lima Línea 2 S.A.,Republic of Peru ,Pending,https://icsid.worldbank.org/cases/case-database/case-detail?CaseNo=ARB/17/3
189,ARB/17/2,Mera Investment Fund Limited,Republic of Serbia ,Pending,https://icsid.worldbank.org/cases/case-database/case-detail?CaseNo=ARB/17/2
190,ARB/17/1,Ortiz Construcciones y Proyectos S.A.,People's Democratic Republic of Algeria,Concluded,https://icsid.worldbank.org/cases/case-database/case-detail?CaseNo=ARB/17/1
191,ARB(AF)/17/1,Air Canada,Bolivarian Republic of Venezuela,Pending,https://icsid.worldbank.org/cases/case-database/case-detail?CaseNo=ARB(AF)/17/1
192,ARB/16/42,Omega Engineering LLC and Oscar Rivera,Republic of Panama,Pending,https://icsid.worldbank.org/cases/case-database/case-detail?CaseNo=ARB/16/42
193,ARB/16/41,Eco Oro Minerals Corp.,Republic of Colombia,Pending,https://icsid.worldbank.org/cases/case-database/case-detail?CaseNo=ARB/16/41
194,ARB/16/40,Saint Patrick Properties Corporation,Bolivarian Republic of Venezuela,Pending,https://icsid.worldbank.org/cases/case-database/case-detail?CaseNo=ARB/16/40
195,ARB/16/39,VC Holding II S.a.r.l. and others ,Italian Republic,Pending,https://icsid.worldbank.org/cases/case-database/case-detail?CaseNo=ARB/16/39
196,ARB/16/38,"Staur Eiendom AS, EBO Invest AS and Rox Holding AS",Republic of Latvia,Concluded,https://icsid.worldbank.org/cases/case-database/case-detail?CaseNo=ARB/16/38
197,ARB/16/37,"LP Egypt Holdings I, LLC, Fund III Egypt, LLC and OMLP Egypt Holdings I, LLC",Arab Republic of Egypt ,Concluded,https://icsid.worldbank.org/cases/case-database/case-detail?CaseNo=ARB/16/37
198,ARB/16/36,"Viaduct d.o.o. Portorož, Vladimir Zevnik and Boris Goljevšček",Bosnia and Herzegovina,Pending,https://icsid.worldbank.org/cases/case-database/case-detail?CaseNo=ARB/16/36
199,ARB/16/35,Emergofin B.V. and Velbay Holdings Ltd.,Ukraine,Pending,https://icsid.worldbank.org/cases/case-database/case-detail?CaseNo=ARB/16/35
200,ARB/16/34,"Bridgestone Licensing Services, Inc. and Bridgestone Americas, Inc.",Republic of Panama,Concluded,https://icsid.worldbank.org/cases/case-database/case-detail?CaseNo=ARB/16/34
201,ARB/16/33,APM Terminals Callao S.A.,Republic of Peru ,Concluded,https://icsid.worldbank.org/cases/case-database/case-detail?CaseNo=ARB/16/33
202,ARB(AF)/16/5,América Móvil S.A.B. de C.V.,Republic of Colombia,Pending,https://icsid.worldbank.org/cases/case-database/case-detail?CaseNo=ARB(AF)/16/5
203,ARB/16/32,Thomas Gosling and others,Republic of Mauritius,Concluded,https://icsid.worldbank.org/cases/case-database/case-detail?CaseNo=ARB/16/32
204,ARB/16/31,UniCredit Bank Austria AG and Zagrebačka Banka d.d.,Republic of Croatia,Pending,https://icsid.worldbank.org/cases/case-database/case-detail?CaseNo=ARB/16/31
205,ARB(AF)/16/4,JSC Tashkent Mechanical Plant and others,Kyrgyz Republic,Pending,https://icsid.worldbank.org/cases/case-database/case-detail?CaseNo=ARB(AF)/16/4
206,ARB/16/30,Görkem Inşaat Sanayi ve Ticaret Limited Şirketi,Turkmenistan,Concluded,https://icsid.worldbank.org/cases/case-database/case-detail?CaseNo=ARB/16/30
207,ARB/16/29,AVAX S.A.,Lebanese Republic,Pending,https://icsid.worldbank.org/cases/case-database/case-detail?CaseNo=ARB/16/29
208,ARB/16/28,Amlyn Holding B.V. ,Republic of Croatia,Pending,https://icsid.worldbank.org/cases/case-database/case-detail?CaseNo=ARB/16/28
209,ARB/16/27,Sevilla Beheer B.V. and others,Kingdom of Spain,Pending,https://icsid.worldbank.org/cases/case-database/case-detail?CaseNo=ARB/16/27
210,ARB(AF)/16/3,"B-Mex, LLC and others",United Mexican States,Pending,https://icsid.worldbank.org/cases/case-database/case-detail?CaseNo=ARB(AF)/16/3
211,ARB/16/26,Oleovest Pte. Ltd.,Republic of Indonesia,Concluded,https://icsid.worldbank.org/cases/case-database/case-detail?CaseNo=ARB/16/26
212,ARB/16/25,Raymond Charles Eyre and Montrose Developments (Private) Limited,Democratic Socialist Republic of Sri Lanka,Pending,https://icsid.worldbank.org/cases/case-database/case-detail?CaseNo=ARB/16/25
213,ARB/16/24,"ČEZ, a.s.",Republic of Bulgaria,Pending,https://icsid.worldbank.org/cases/case-database/case-detail?CaseNo=ARB/16/24
214,ARB/16/23,"Agroinsumos Ibero-Americanos, S.L. and others",Bolivarian Republic of Venezuela,Pending,https://icsid.worldbank.org/cases/case-database/case-detail?CaseNo=ARB/16/23
215,ARB/16/22,Shell Philippines Exploration B.V.,Republic of the Philippines,Pending,https://icsid.worldbank.org/cases/case-database/case-detail?CaseNo=ARB/16/22
216,ARB/16/21,TransCanada Corporation and TransCanada PipeLines Limited,United States of America,Concluded,https://icsid.worldbank.org/cases/case-database/case-detail?CaseNo=ARB/16/21
217,ARB/16/20,Iskandar Safa and Akram Safa,Hellenic Republic,Pending,https://icsid.worldbank.org/cases/case-database/case-detail?CaseNo=ARB/16/20
218,ARB/16/19,"Nova Group Investments, B.V.",Romania,Pending,https://icsid.worldbank.org/cases/case-database/case-detail?CaseNo=ARB/16/19
219,ARB/16/18,Infracapital F1 S.à r.l. and Infracapital Solar B.V.,Kingdom of Spain,Pending,https://icsid.worldbank.org/cases/case-database/case-detail?CaseNo=ARB/16/18
220,ARB/16/17,Sun-Flower Olmeda GmbH & Co KG and others,Kingdom of Spain,Pending,https://icsid.worldbank.org/cases/case-database/case-detail?CaseNo=ARB/16/17
221,ARB/16/16,Global Telecom Holding S.A.E. ,Canada,Pending,https://icsid.worldbank.org/cases/case-database/case-detail?CaseNo=ARB/16/16
222,UNCT/02/1,United Parcels Service of America Inc.,Canada,Concluded,https://icsid.worldbank.org/cases/case-database/case-detail?CaseNo=UNCT/02/1
223,ARB(AF)/16/2,Lao Holdings N.V.,Lao People’s Democratic Republic,Pending,https://icsid.worldbank.org/cases/case-database/case-detail?CaseNo=ARB(AF)/16/2
224,CONC/16/1,Xenofon Karagiannis,Republic of Albania,Pending,https://icsid.worldbank.org/cases/case-database/case-detail?CaseNo=CONC/16/1
225,ARB(AF)/16/1,Luis García Armas,Bolivarian Republic of Venezuela,Pending,https://icsid.worldbank.org/cases/case-database/case-detail?CaseNo=ARB(AF)/16/1
226,ARB/16/15,AngloGold Ashanti (Ghana) Limited,Republic of Ghana,Concluded,https://icsid.worldbank.org/cases/case-database/case-detail?CaseNo=ARB/16/15
227,ARB/16/14,"ENGIE SA, GDF International SAS and ENGIE International Holdings BV",Hungary,Concluded,https://icsid.worldbank.org/cases/case-database/case-detail?CaseNo=ARB/16/14
228,ARB/16/13,Dominion Minerals Corp.,Republic of Panama,Pending,https://icsid.worldbank.org/cases/case-database/case-detail?CaseNo=ARB/16/13
229,UNCT/07/1,Merrill & Ring Forestry L.P.,Canada,Concluded,https://icsid.worldbank.org/cases/case-database/case-detail?CaseNo=UNCT/07/1
230,ARB/16/12,Alhambra Resources Ltd. and Alhambra Coӧperatief U.A.,Republic of Kazakhstan,Pending,https://icsid.worldbank.org/cases/case-database/case-detail?CaseNo=ARB/16/12
231,ARB/16/11,"Société Resort Company Invest Abidjan, Stanislas Citerici and Gérard Bot",Republic of Côte d'Ivoire,Pending,https://icsid.worldbank.org/cases/case-database/case-detail?CaseNo=ARB/16/11
232,ARB/16/10,Kunsttrans Holding GmbH and Kunsttrans d.o.o. Beograd,Republic of Serbia,Concluded,https://icsid.worldbank.org/cases/case-database/case-detail?CaseNo=ARB/16/10
233,ARB/16/9,Italba Corporation,Oriental Republic of Uruguay,Concluded,https://icsid.worldbank.org/cases/case-database/case-detail?CaseNo=ARB/16/9
234,ARB/16/8,Zbigniew Piotr Grot and others,Republic of Moldova,Concluded,https://icsid.worldbank.org/cases/case-database/case-detail?CaseNo=ARB/16/8
235,ARB/16/7,Attila Doğan Construction & Installation Co. Inc.,Sultanate of Oman,Pending,https://icsid.worldbank.org/cases/case-database/case-detail?CaseNo=ARB/16/7
236,ARB/16/6,Glencore International A.G. and C.I. Prodeco S.A.,Republic of Colombia,Pending,https://icsid.worldbank.org/cases/case-database/case-detail?CaseNo=ARB/16/6
237,ARB/16/5,"ESPF Beteiligungs GmbH, ESPF Nr. 2 Austria Beteiligungs GmbH, and InfraClass Energie 5 GmbH & Co. KG",Italian Republic,Pending,https://icsid.worldbank.org/cases/case-database/case-detail?CaseNo=ARB/16/5
238,ARB/16/4,Eurus Energy Holdings Corporation,Kingdom of Spain,Pending,https://icsid.worldbank.org/cases/case-database/case-detail?CaseNo=ARB/16/4
239,ARB/16/3,Veolia Environnement S.A. and others,Republic of Lithuania,Pending,https://icsid.worldbank.org/cases/case-database/case-detail?CaseNo=ARB/16/3
240,ARB/16/2,Champion Holding Company and others,Arab Republic of Egypt,Concluded,https://icsid.worldbank.org/cases/case-database/case-detail?CaseNo=ARB/16/2
241,ARB/16/1,Al Jazeera Media Network,Arab Republic of Egypt,Pending,https://icsid.worldbank.org/cases/case-database/case-detail?CaseNo=ARB/16/1
242,ARB(AF)/15/2,Lion Mexico Consolidated L.P.,United Mexican States,Pending,https://icsid.worldbank.org/cases/case-database/case-detail?CaseNo=ARB(AF)/15/2
243,ARB/15/50,Eskosol S.p.A. in liquidazione,Italian Republic,Pending,https://icsid.worldbank.org/cases/case-database/case-detail?CaseNo=ARB/15/50
244,ARB/15/49,Theodoros Adamakopoulos and others,Republic of Cyprus,Pending,https://icsid.worldbank.org/cases/case-database/case-detail?CaseNo=ARB/15/49
245,ARB/15/48,"Abertis Infraestructuras, S.A.",Argentine Republic,Concluded,https://icsid.worldbank.org/cases/case-database/case-detail?CaseNo=ARB/15/48
246,ARB/15/47,ArcelorMittal S.A.,Arab Republic of Egypt,Concluded,https://icsid.worldbank.org/cases/case-database/case-detail?CaseNo=ARB/15/47
247,ARB/15/46,BSG Resources (Guinea) Limited and BSG Resources (Guinea) SÀRL,Republic of Guinea,Concluded,https://icsid.worldbank.org/cases/case-database/case-detail?CaseNo=ARB/15/46
248,ARB/15/45,Landesbank Baden-Württemberg and others,Kingdom of Spain,Pending,https://icsid.worldbank.org/cases/case-database/case-detail?CaseNo=ARB/15/45
249,ARB/15/44,Watkins Holdings S.à r.l. and others,Kingdom of Spain,Pending,https://icsid.worldbank.org/cases/case-database/case-detail?CaseNo=ARB/15/44
250,ARB/15/43,State General Reserve Fund of the Sultanate of Oman,Republic of Bulgaria,Concluded,https://icsid.worldbank.org/cases/case-database/case-detail?CaseNo=ARB/15/43
251,ARB/15/42,Hydro Energy 1 S.à r.l. and Hydroxana Sweden AB,Kingdom of Spain,Concluded,https://icsid.worldbank.org/cases/case-database/case-detail?CaseNo=ARB/15/42
252,ARB/15/41,Standard Chartered Bank (Hong Kong) Limited,United Republic of Tanzania,Concluded,https://icsid.worldbank.org/cases/case-database/case-detail?CaseNo=ARB/15/41
253,ARB/15/40,Belenergia S.A.,Italian Republic,Concluded,https://icsid.worldbank.org/cases/case-database/case-detail?CaseNo=ARB/15/40
254,ARB/15/39,Webuild S.p.A. (formerly Salini Impregilo S.p.A.),Argentine Republic,Pending,https://icsid.worldbank.org/cases/case-database/case-detail?CaseNo=ARB/15/39
255,UNCT/15/3,David Aven et al.,Republic of Costa Rica,Concluded,https://icsid.worldbank.org/cases/case-database/case-detail?CaseNo=UNCT/15/3
256,ARB/15/38,SolEs Badajoz GmbH,Kingdom of Spain,Pending,https://icsid.worldbank.org/cases/case-database/case-detail?CaseNo=ARB/15/38
257,ARB/15/37,Silver Ridge Power BV,Italian Republic,Pending,https://icsid.worldbank.org/cases/case-database/case-detail?CaseNo=ARB/15/37
258,ARB/15/36,OperaFund Eco-Invest SICAV PLC and Schwab Holding AG,Kingdom of Spain,Pending,https://icsid.worldbank.org/cases/case-database/case-detail?CaseNo=ARB/15/36
259,ARB/15/35,"E.ON SE, E.ON Finanzanlagen GmbH and E.ON Iberia Holding GmbH",Kingdom of Spain,Pending,https://icsid.worldbank.org/cases/case-database/case-detail?CaseNo=ARB/15/35
260,ARB/15/34,"Cavalum SGPS, S.A.",Kingdom of Spain,Pending,https://icsid.worldbank.org/cases/case-database/case-detail?CaseNo=ARB/15/34
261,ARB/15/33,Gilward Investments B.V.,Ukraine,Pending,https://icsid.worldbank.org/cases/case-database/case-detail?CaseNo=ARB/15/33
262,ARB/15/32,B.V. Belegging-Maatschappij “Far East”,Republic of Austria,Concluded,https://icsid.worldbank.org/cases/case-database/case-detail?CaseNo=ARB/15/32
263,ARB/15/31,Gabriel Resources Ltd. and Gabriel Resources (Jersey),Romania,Pending,https://icsid.worldbank.org/cases/case-database/case-detail?CaseNo=ARB/15/31
264,ARB(AF)/15/1,Strabag SE ,Libya,Concluded,https://icsid.worldbank.org/cases/case-database/case-detail?CaseNo=ARB(AF)/15/1
265,ARB/15/30,"Samsung Engineering Co., Ltd.",Sultanate of Oman,Concluded,https://icsid.worldbank.org/cases/case-database/case-detail?CaseNo=ARB/15/30
266,ARB/15/29,"Cortec Mining Kenya Limited, Cortec (Pty) Limited and Stirling Capital Limited",Republic of Kenya,Pending,https://icsid.worldbank.org/cases/case-database/case-detail?CaseNo=ARB/15/29
267,ARB/15/28,Hydro S.r.l. and others,Republic of Albania,Pending,https://icsid.worldbank.org/cases/case-database/case-detail?CaseNo=ARB/15/28
268,ARB/15/27,JGC Holdings Corporation (formerly JGC Corporation),Kingdom of Spain,Pending,https://icsid.worldbank.org/cases/case-database/case-detail?CaseNo=ARB/15/27
269,ARB/15/26,Nabucco Gas Pipeline International GmbH in Liqu.,Republic of Turkey,Concluded,https://icsid.worldbank.org/cases/case-database/case-detail?CaseNo=ARB/15/26
270,ARB/15/25,KS Invest GmbH and TLS Invest GmbH,Kingdom of Spain,Pending,https://icsid.worldbank.org/cases/case-database/case-detail?CaseNo=ARB/15/25
271,ARB/15/24,Ali Alyafei,Hashemite Kingdom of Jordan,Concluded,https://icsid.worldbank.org/cases/case-database/case-detail?CaseNo=ARB/15/24
272,ARB/15/23,Mathias Kruck and others,Kingdom of Spain ,Pending,https://icsid.worldbank.org/cases/case-database/case-detail?CaseNo=ARB/15/23
273,ARB/15/22,ACP Axos Capital GmbH,Republic of Kosovo,Concluded,https://icsid.worldbank.org/cases/case-database/case-detail?CaseNo=ARB/15/22
274,ARB/15/21,Menzies Middle East and Africa S.A. and Aviation Handling Services International Ltd.,Republic of Senegal,Concluded,https://icsid.worldbank.org/cases/case-database/case-detail?CaseNo=ARB/15/21
275,ARB/15/20,Cube Infrastructure Fund SICAV and others,Kingdom of Spain ,Pending,https://icsid.worldbank.org/cases/case-database/case-detail?CaseNo=ARB/15/20
276,ARB/15/19,ENERGO-PRO a.s.,Republic of Bulgaria,Pending,https://icsid.worldbank.org/cases/case-database/case-detail?CaseNo=ARB/15/19
277,ARB/15/18,Capital Financial Holdings Luxembourg S.A.,Republic of Cameroon,Concluded,https://icsid.worldbank.org/cases/case-database/case-detail?CaseNo=ARB/15/18
278,ARB/15/17,Hanocal Holding B.V. and IPIC International B.V.,Republic of Korea,Concluded,https://icsid.worldbank.org/cases/case-database/case-detail?CaseNo=ARB/15/17
279,ARB/15/16,BayWa r.e. renewable energy GmbH and BayWa r.e. Asset Holding GmbH,Kingdom of Spain,Pending,https://icsid.worldbank.org/cases/case-database/case-detail?CaseNo=ARB/15/16
280,ARB/15/15,9REN Holding S.a.r.l,Kingdom of Spain,Pending,https://icsid.worldbank.org/cases/case-database/case-detail?CaseNo=ARB/15/15
281,UNCT/15/2,Lone Pine Resources Inc.,Canada,Pending,https://icsid.worldbank.org/cases/case-database/case-detail?CaseNo=UNCT/15/2
282,ARB/15/14,Álvarez y Marín Corporación S.A. and others,Republic of Panama,Concluded,https://icsid.worldbank.org/cases/case-database/case-detail?CaseNo=ARB/15/14
283,ARB/15/13,Devincci Salah Hourani and Issam Salah Hourani,Republic of Kazakhstan,Concluded,https://icsid.worldbank.org/cases/case-database/case-detail?CaseNo=ARB/15/13
284,ARB/15/12,"PT Ventures, SGPS, S.A.",Republic of Cabo Verde,Concluded,https://icsid.worldbank.org/cases/case-database/case-detail?CaseNo=ARB/15/12
285,UNCT/15/1,A11Y LTD.,Czech Republic,Concluded,https://icsid.worldbank.org/cases/case-database/case-detail?CaseNo=UNCT/15/1
286,ARB/15/11,Total E&P Uganda BV,Republic of Uganda,Concluded,https://icsid.worldbank.org/cases/case-database/case-detail?CaseNo=ARB/15/11
287,ARB/15/10,Orange SA,Hashemite Kingdom of Jordan,Concluded,https://icsid.worldbank.org/cases/case-database/case-detail?CaseNo=ARB/15/10
288,ARB/15/9,Poltava Gas B.V. and Poltava Petroleum Company,Ukraine,Concluded,https://icsid.worldbank.org/cases/case-database/case-detail?CaseNo=ARB/15/9
289,ARB/15/8,Aktau Petrol Ticaret A.Ş.,Republic of Kazakhstan,Concluded,https://icsid.worldbank.org/cases/case-database/case-detail?CaseNo=ARB/15/8
290,ARB/15/7,WalAm Energy LLC,Republic of Kenya,Concluded,https://icsid.worldbank.org/cases/case-database/case-detail?CaseNo=ARB/15/7
291,UNCT/10/2,Apotex Inc.,United States of America,Concluded,https://icsid.worldbank.org/cases/case-database/case-detail?CaseNo=UNCT/10/2
292,UNCT/10/1,AbitibiBowater Inc.,Canada,Concluded,https://icsid.worldbank.org/cases/case-database/case-detail?CaseNo=UNCT/10/1
293,ARB/15/6,Mobil Investments Canada Inc.,Canada,Concluded,https://icsid.worldbank.org/cases/case-database/case-detail?CaseNo=ARB/15/6
294,ARB/15/5,B3 Croatian Courier Coöperatief U.A. ,Republic of Croatia ,Concluded,https://icsid.worldbank.org/cases/case-database/case-detail?CaseNo=ARB/15/5
295,ARB/15/4,STEAG GmbH,Kingdom of Spain ,Pending,https://icsid.worldbank.org/cases/case-database/case-detail?CaseNo=ARB/15/4
296,ARB/15/3,Abed El Jaouni,Lebanese Republic,Pending,https://icsid.worldbank.org/cases/case-database/case-detail?CaseNo=ARB/15/3
297,ARB/15/2,"Lighthouse Corporation Pty Ltd and Lighthouse Corporation Ltd, IBC",Democratic Republic of Timor-Leste,Concluded,https://icsid.worldbank.org/cases/case-database/case-detail?CaseNo=ARB/15/2
298,ARB/15/1,"Stadtwerke München GmbH, RWE Innogy GmbH, and others",Kingdom of Spain,Pending,https://icsid.worldbank.org/cases/case-database/case-detail?CaseNo=ARB/15/1
299,ARB/14/35,Baymina Enerji Anonim Şirketi,Boru Hatları ile Petrol Taşıma Anonim Şirketi,Concluded,https://icsid.worldbank.org/cases/case-database/case-detail?CaseNo=ARB/14/35
300,ARB/14/34,RWE Innogy GmbH and RWE Innogy Aersa S.A.U.,Kingdom of Spain,Pending,https://icsid.worldbank.org/cases/case-database/case-detail?CaseNo=ARB/14/34
301,ARB/14/33,"IBT Group LLC., Constructor, Consulting and Engineering (Panamá), S.A., and International Business and Trade, LLC.",Republic of Panama,Concluded,https://icsid.worldbank.org/cases/case-database/case-detail?CaseNo=ARB/14/33
302,ARB/14/32,Casinos Austria International GmbH and Casinos Austria Aktiengesellschaft,Argentine Republic,Pending,https://icsid.worldbank.org/cases/case-database/case-detail?CaseNo=ARB/14/32
303,ARB/14/31,Tariq Bashir and SA Interpétrol Burundi,Republic of Burundi,Concluded,https://icsid.worldbank.org/cases/case-database/case-detail?CaseNo=ARB/14/31
304,ARB/12/39,Georg Gavrilovic and Gavrilovic d.o.o.,Republic of Croatia,Concluded,https://icsid.worldbank.org/cases/case-database/case-detail?CaseNo=ARB/12/39
305,ARB/14/30,Beijing Urban Construction Group Co. Ltd.,Republic of Yemen,Concluded,https://icsid.worldbank.org/cases/case-database/case-detail?CaseNo=ARB/14/30
306,ARB/14/29,"Ioan Micula, Viorel Micula and others",Romania,Pending,https://icsid.worldbank.org/cases/case-database/case-detail?CaseNo=ARB/14/29
307,ARB/14/28,Alpiq AG,Romania ,Pending,https://icsid.worldbank.org/cases/case-database/case-detail?CaseNo=ARB/14/28
308,ARB/14/27,Zelena N.V. and Energo-Zelena d.o.o Inđija,Republic of Serbia,Concluded,https://icsid.worldbank.org/cases/case-database/case-detail?CaseNo=ARB/14/27
309,ARB/14/26,"Albaniabeg Ambient Sh.p.k, M. Angelo Novelli and Costruzioni S.r.l.",Republic of Albania ,Pending,https://icsid.worldbank.org/cases/case-database/case-detail?CaseNo=ARB/14/26
310,ARB/14/25,"Ansung Housing Co., Ltd.",People's Republic of China ,Concluded,https://icsid.worldbank.org/cases/case-database/case-detail?CaseNo=ARB/14/25
311,ARB/10/18,Niko Resources (Bangladesh) Ltd.,"Bangladesh Petroleum Exploration and Production Company Limited (""Bapex"") and Bangladesh Oil Gas and Mineral Corporation (""Petrobangla"")",Pending,https://icsid.worldbank.org/cases/case-database/case-detail?CaseNo=ARB/10/18
312,ARB/14/24,United Utilities (Tallinn) B.V. and Aktsiaselts Tallinna Vesi,Republic of Estonia,Concluded,https://icsid.worldbank.org/cases/case-database/case-detail?CaseNo=ARB/14/24
313,ARB/14/23,Tamagot Bumi S.A. and Bumi Mauritania S.A.,Islamic Republic of Mauritania,Concluded,https://icsid.worldbank.org/cases/case-database/case-detail?CaseNo=ARB/14/23
314,ARB/12/1,Tethyan Copper Company Pty Limited,Islamic Republic of Pakistan,Pending,https://icsid.worldbank.org/cases/case-database/case-detail?CaseNo=ARB/12/1
315,ARB(AF)/00/2,"Técnicas Medioambientales Tecmed, S.A.",United Mexican States ,Concluded,https://icsid.worldbank.org/cases/case-database/case-detail?CaseNo=ARB(AF)/00/2
316,ARB/14/22,"BSG Resources Limited (in administration), BSG Resources (Guinea) Limited and BSG Resources (Guinea) SÀRL",Republic of Guinea,Pending,https://icsid.worldbank.org/cases/case-database/case-detail?CaseNo=ARB/14/22
317,ARB/14/21,Bear Creek Mining Corporation,Republic of Peru,Concluded,https://icsid.worldbank.org/cases/case-database/case-detail?CaseNo=ARB/14/21
318,ARB/14/20,Sodexo Pass International SAS,Hungary,Pending,https://icsid.worldbank.org/cases/case-database/case-detail?CaseNo=ARB/14/20
319,ARB/14/19,VICAT,Republic of Senegal,Concluded,https://icsid.worldbank.org/cases/case-database/case-detail?CaseNo=ARB/14/19
320,ARB/14/18,RENERGY S.à r.l. ,Kingdom of Spain,Pending,https://icsid.worldbank.org/cases/case-database/case-detail?CaseNo=ARB/14/18
321,ARB(AF)/14/3,"Corona Materials, LLC ",Dominican Republic,Concluded,https://icsid.worldbank.org/cases/case-database/case-detail?CaseNo=ARB(AF)/14/3
322,ARB/14/17,Krederi Ltd.,Ukraine,Concluded,https://icsid.worldbank.org/cases/case-database/case-detail?CaseNo=ARB/14/17
